{
  "schema_version": 1,
  "snapshot_id": "specforge-source-to-intent-reviewed-v4",
  "owner": "SPEC-TO-INTENT-ALIGNMENT.6b.ii.b",
  "reviewed_revision": "03e89b66cf87fcc1ec0bf342f47a147261a8d739",
  "objective_contract": {
    "path": "doctrine/spec_to_intent_category_contract.json",
    "sha256": "b5d0582f213b38a0273594a46e6a11cca3b1cce24a3c7156d300156b81ca7007",
    "role": "category-aware source-to-IntentIR objective contract"
  },
  "stall_window": 3,
  "dimensions": [
    {
      "dimension": "source_capture",
      "objective": "prove that each bounded source region and required modality is observable before semantic scoring",
      "metrics": [
        {
          "metric_id": "exact_source_region_capture",
          "question": "are all reviewed intent-bearing source regions found exactly",
          "measure": {
            "numerator": 14,
            "denominator": 14
          },
          "target": {
            "operator": "equal",
            "value": {
              "numerator": 1,
              "denominator": 1
            }
          },
          "improvement": "higher_is_better",
          "material_change": {
            "numerator": 1,
            "denominator": 100
          },
          "hard": false,
          "required": true,
          "oracle": "complete bounded source-region gold",
          "population": "14 reviewed document-family-modality cells",
          "uncertainty": {
            "kind": "exact"
          },
          "evidence": [
            {
              "path": "crates/specforge/test_data/source_to_intent_vertical/current_result_snapshot.json",
              "sha256": "9e8cd99b8c931c969b545fe80bfe20919969ff6523f1580f1a144915717ec6b1",
              "role": "qualified .6b.ii.b current-binary reviewed vertical result"
            }
          ]
        },
        {
          "metric_id": "exact_required_modality_capture",
          "question": "are all reviewed required-modality captures found exactly",
          "measure": {
            "numerator": 13,
            "denominator": 14
          },
          "target": {
            "operator": "equal",
            "value": {
              "numerator": 1,
              "denominator": 1
            }
          },
          "improvement": "higher_is_better",
          "material_change": {
            "numerator": 1,
            "denominator": 100
          },
          "hard": false,
          "required": true,
          "oracle": "complete bounded evidence-capture gold",
          "population": "14 reviewed document-family-modality cells",
          "uncertainty": {
            "kind": "exact"
          },
          "evidence": [
            {
              "path": "crates/specforge/test_data/source_to_intent_vertical/current_result_snapshot.json",
              "sha256": "9e8cd99b8c931c969b545fe80bfe20919969ff6523f1580f1a144915717ec6b1",
              "role": "qualified .6b.ii.b current-binary reviewed vertical result"
            }
          ]
        }
      ]
    },
    {
      "dimension": "semantic_correctness",
      "objective": "retain only canonical IntentIR facts that match complete reviewed gold",
      "metrics": [
        {
          "metric_id": "intent_canonical_precision",
          "question": "what fraction of emitted canonical IntentIR facts is correct",
          "measure": {
            "numerator": 19,
            "denominator": 29
          },
          "target": {
            "operator": "equal",
            "value": {
              "numerator": 1,
              "denominator": 1
            }
          },
          "improvement": "higher_is_better",
          "material_change": {
            "numerator": 1,
            "denominator": 100
          },
          "hard": false,
          "required": true,
          "oracle": "complete bounded canonical IntentIR answer keys",
          "population": "all emitted canonical facts in 14 reviewed cells",
          "uncertainty": {
            "kind": "exact"
          },
          "evidence": [
            {
              "path": "crates/specforge/test_data/source_to_intent_vertical/current_result_snapshot.json",
              "sha256": "9e8cd99b8c931c969b545fe80bfe20919969ff6523f1580f1a144915717ec6b1",
              "role": "qualified .6b.ii.b current-binary reviewed vertical result"
            }
          ]
        }
      ]
    },
    {
      "dimension": "semantic_completeness",
      "objective": "preserve every expected canonical fact and support every reviewed category",
      "metrics": [
        {
          "metric_id": "intent_canonical_recall",
          "question": "what fraction of expected canonical facts reaches IntentIR correctly",
          "measure": {
            "numerator": 19,
            "denominator": 40
          },
          "target": {
            "operator": "equal",
            "value": {
              "numerator": 1,
              "denominator": 1
            }
          },
          "improvement": "higher_is_better",
          "material_change": {
            "numerator": 1,
            "denominator": 100
          },
          "hard": false,
          "required": true,
          "oracle": "complete bounded canonical IntentIR answer keys",
          "population": "40 expected canonical facts in 14 reviewed cells",
          "uncertainty": {
            "kind": "exact"
          },
          "evidence": [
            {
              "path": "crates/specforge/test_data/source_to_intent_vertical/current_result_snapshot.json",
              "sha256": "9e8cd99b8c931c969b545fe80bfe20919969ff6523f1580f1a144915717ec6b1",
              "role": "qualified .6b.ii.b current-binary reviewed vertical result"
            }
          ]
        },
        {
          "metric_id": "supported_reviewed_categories",
          "question": "how many reviewed dominant-purpose categories meet the completeness contract",
          "measure": {
            "numerator": 0,
            "denominator": 6
          },
          "target": {
            "operator": "equal",
            "value": {
              "numerator": 1,
              "denominator": 1
            }
          },
          "improvement": "higher_is_better",
          "material_change": {
            "numerator": 1,
            "denominator": 100
          },
          "hard": false,
          "required": true,
          "oracle": "category-aware completeness status",
          "population": "six reviewed dominant-purpose categories",
          "uncertainty": {
            "kind": "exact"
          },
          "evidence": [
            {
              "path": "crates/specforge/test_data/source_to_intent_vertical/current_result_snapshot.json",
              "sha256": "9e8cd99b8c931c969b545fe80bfe20919969ff6523f1580f1a144915717ec6b1",
              "role": "qualified .6b.ii.b current-binary reviewed vertical result"
            }
          ]
        }
      ]
    },
    {
      "dimension": "stage_conservation",
      "objective": "conserve each expected fact across every required boundary or explain it with a typed residual",
      "metrics": [
        {
          "metric_id": "stage_conservation_or_residual",
          "question": "what fraction of required boundary crossings is conserved or residualized",
          "measure": {
            "numerator": 57,
            "denominator": 78
          },
          "target": {
            "operator": "equal",
            "value": {
              "numerator": 1,
              "denominator": 1
            }
          },
          "improvement": "higher_is_better",
          "material_change": {
            "numerator": 1,
            "denominator": 100
          },
          "hard": false,
          "required": true,
          "oracle": "exact three-boundary vertical conservation accounting",
          "population": "54 required stage-boundary crossings",
          "uncertainty": {
            "kind": "exact"
          },
          "evidence": [
            {
              "path": "crates/specforge/test_data/source_to_intent_vertical/current_result_snapshot.json",
              "sha256": "9e8cd99b8c931c969b545fe80bfe20919969ff6523f1580f1a144915717ec6b1",
              "role": "qualified .6b.ii.b current-binary reviewed vertical result"
            }
          ]
        }
      ]
    },
    {
      "dimension": "provenance_honesty",
      "objective": "forbid fabricated canonical facts and retain source provenance on every promoted fact",
      "metrics": [
        {
          "metric_id": "canonical_provenance_closure",
          "question": "what fraction of emitted canonical facts closes required provenance",
          "measure": {
            "numerator": 17,
            "denominator": 29
          },
          "target": {
            "operator": "equal",
            "value": {
              "numerator": 1,
              "denominator": 1
            }
          },
          "improvement": "higher_is_better",
          "material_change": {
            "numerator": 1,
            "denominator": 100
          },
          "hard": false,
          "required": true,
          "oracle": "complete bounded provenance requirements",
          "population": "all emitted canonical records in 14 reviewed cells",
          "uncertainty": {
            "kind": "exact"
          },
          "evidence": [
            {
              "path": "crates/specforge/test_data/source_to_intent_vertical/current_result_snapshot.json",
              "sha256": "9e8cd99b8c931c969b545fe80bfe20919969ff6523f1580f1a144915717ec6b1",
              "role": "qualified .6b.ii.b current-binary reviewed vertical result"
            }
          ]
        },
        {
          "metric_id": "fabricated_canonical_fact_rate",
          "question": "what fraction of emitted canonical facts is fabricated",
          "measure": {
            "numerator": 10,
            "denominator": 29
          },
          "target": {
            "operator": "equal",
            "value": {